{
  "schema_version": 1,
  "standard_version": "1.0",
  "catalog_id": "vibesilicon-rtl-coding-standard-v1",
  "profiles": ["fpga", "asic", "handwritten", "generated"],
  "rules": [
    {"id":"RTL-R001","family":"RTL-GEN","level":"MUST","severity":"ERROR","verification":"automated","profiles":["fpga","asic","handwritten","generated"],"evidence":"rtl_readability.json","summary":"Explicit nets and default_nettype boundary"},
    {"id":"RTL-R002","family":"RTL-TYP","level":"MUST","severity":"ERROR","verification":"automated","profiles":["fpga","asic","handwritten","generated"],"evidence":"rtl_readability.json","summary":"Sized arithmetic constants"},
    {"id":"RTL-R003","family":"RTL-TYP","level":"MUST","severity":"WARNING","verification":"automated","profiles":["fpga","asic","handwritten","generated"],"evidence":"rtl_readability.json plus elaborated review","summary":"Explicit signedness and width at mixed expressions"},
    {"id":"RTL-R004","family":"RTL-CMB","level":"MUST","severity":"ERROR","verification":"automated","profiles":["fpga","asic","handwritten","generated"],"evidence":"rtl_readability.json plus elaborated lint","summary":"No unintended latch in combinational paths"},
    {"id":"RTL-R005","family":"RTL-SEQ","level":"MUST","severity":"ERROR","verification":"automated","profiles":["fpga","asic","handwritten","generated"],"evidence":"rtl_readability.json","summary":"Nonblocking assignment for sequential state"},
    {"id":"RTL-R006","family":"RTL-SEQ","level":"MUST","severity":"ERROR","verification":"automated","profiles":["fpga","asic","handwritten","generated"],"evidence":"rtl_readability.json plus elaborated lint","summary":"One driver per net or state"},
    {"id":"RTL-R007","family":"RTL-GEN","level":"MUST","severity":"ERROR","verification":"automated","profiles":["fpga","asic","handwritten","generated"],"evidence":"rtl_readability.json","summary":"Complete Module Contract v1 on each module"},
    {"id":"RTL-R008","family":"RTL-SEQ","level":"MUST","severity":"WARNING","verification":"automated","profiles":["fpga","asic","handwritten","generated"],"evidence":"rtl_readability.json plus assertion and review","summary":"Payload, valid, ready and sideband stage alignment"},
    {"id":"RTL-R009","family":"RTL-CDC","level":"MUST","severity":"ERROR","verification":"automated","profiles":["fpga","asic","handwritten","generated"],"evidence":"rtl_readability.json plus CDC report","summary":"Approved cross-clock structure"},
    {"id":"RTL-R010","family":"RTL-DBG","level":"MUST","severity":"ERROR","verification":"automated","profiles":["fpga","asic","handwritten","generated"],"evidence":"rtl_readability.json plus waiver registry","summary":"Review preservation and debug attributes"},
    {"id":"RTL-GEN-001","family":"RTL-GEN","level":"MUST","severity":"ERROR","verification":"automated","profiles":["fpga","asic","handwritten","generated"],"evidence":"source manifest and multi-file elaboration report","summary":"Explicit design units, dependencies and compile configuration"},
    {"id":"RTL-GEN-002","family":"RTL-GEN","level":"MUST","severity":"ERROR","verification":"manual","profiles":["generated"],"evidence":"generator provenance and reproduction diff","summary":"Generated RTL provenance and immutable output"},
    {"id":"RTL-NAM-001","family":"RTL-NAM","level":"MUST","severity":"WARNING","verification":"manual","profiles":["handwritten"],"evidence":"naming report and interface contract","summary":"Functional signal names and consistent suffixes"},
    {"id":"RTL-TYP-001","family":"RTL-TYP","level":"MUST","severity":"ERROR","verification":"manual","profiles":["fpga","asic","handwritten","generated"],"evidence":"numeric contract, range proof or boundary test","summary":"Fixed-point format, overflow and narrowing semantics"},
    {"id":"RTL-CMB-001","family":"RTL-CMB","level":"MUST","severity":"ERROR","verification":"manual","profiles":["fpga","asic","handwritten","generated"],"evidence":"elaborated lint and simulation","summary":"No combinational loops or simulation-synthesis mismatch"},
    {"id":"RTL-FSM-001","family":"RTL-FSM","level":"MUST","severity":"ERROR","verification":"manual","profiles":["fpga","asic","handwritten","generated"],"evidence":"FSM contract, illegal-state assertion and recovery review","summary":"Evidence-based FSM encoding and illegal-state behavior"},
    {"id":"RTL-RST-001","family":"RTL-RST","level":"MUST","severity":"ERROR","verification":"manual","profiles":["fpga","asic","handwritten","generated"],"evidence":"reset topology, RDC report and owner signoff","summary":"Reset scope, release and reset-domain crossing"},
    {"id":"RTL-CLK-001","family":"RTL-CLK","level":"MUST","severity":"ERROR","verification":"manual","profiles":["fpga","asic","handwritten","generated"],"evidence":"clock topology, constraints and implementation review","summary":"Generated and gated clocks use approved structures"},
    {"id":"RTL-CDC-001","family":"RTL-CDC","level":"MUST","severity":"ERROR","verification":"manual","profiles":["fpga","asic","handwritten","generated"],"evidence":"CDC report, synchronizer review and timing exception proof","summary":"CDC protocol and constraints match actual circuit"},
    {"id":"RTL-IFC-001","family":"RTL-IFC","level":"MUST","severity":"ERROR","verification":"manual","profiles":["fpga","asic","handwritten","generated"],"evidence":"protocol assertion and backpressure trace","summary":"Stable payload and sideband under backpressure"},
    {"id":"RTL-MEM-001","family":"RTL-MEM","level":"MUST","severity":"ERROR","verification":"manual","profiles":["fpga","asic","handwritten","generated"],"evidence":"memory contract, inference report and boundary tests","summary":"Memory semantics, inference target and initialization"},
    {"id":"RTL-MEM-002","family":"RTL-MEM","level":"SHOULD","severity":"WARNING","verification":"manual","profiles":["fpga","asic","handwritten","generated"],"evidence":"storage boundary or documented inline rationale with inference and latency review","summary":"Separate nontrivial storage implementation from access control; allow small local arrays inline"},
    {"id":"RTL-XPR-001","family":"RTL-XPR","level":"MUST","severity":"ERROR","verification":"automated","profiles":["fpga","asic","handwritten","generated"],"evidence":"content-addressed four-state shadow inventory plus review","summary":"No unsafe X/Z or unsupported design constructs"},
    {"id":"RTL-VER-001","family":"RTL-VER","level":"MUST","severity":"ERROR","verification":"manual","profiles":["fpga","asic","handwritten","generated"],"evidence":"requirement-to-checker mapping and regression report","summary":"Module invariants have observable verification"},
    {"id":"RTL-MNT-001","family":"RTL-MNT","level":"SHOULD","severity":"WARNING","verification":"automated","profiles":["handwritten"],"evidence":"content-addressed maintenance shadow report","summary":"Readable complexity and owned TODOs"},
    {"id":"RTL-FPGA-001","family":"RTL-GEN","level":"MUST","severity":"ERROR","verification":"manual","profiles":["fpga"],"evidence":"wrapper, device report and target constraint","summary":"FPGA primitives and initialization are target-verified"},
    {"id":"RTL-ASIC-001","family":"RTL-GEN","level":"MUST","severity":"ERROR","verification":"manual","profiles":["asic"],"evidence":"PDK, memory, ICG, DFT and power owner contracts","summary":"ASIC-specific implementation assumptions are signed off"}
  ]
}
